{
  "schemaVersion": "1.0",
  "repoVersion": "1.0.0",
  "updated": "2026-10-07",
  "entries": [
    {
      "id": "hello-mox",
      "name": "Hello mox",
      "version": "1.0.1",
      "author": "codecloud-dev",
      "description": "官方最小示例插件：演示 .mox 清单格式与插件商店的安装流程。",
      "type": "plugin",
      "minAppVersion": "0.5.0",
      "permissions": [],
      "price": 0.0,
      "purchased": false,
      "sizeBytes": 0,
      "tags": ["demo", "official"],
      "repository": "codecloud-dev/moxsh-plugins",
      "path": "plugins/hello-mox"
    },
    {
      "id": "glass-terminal-theme",
      "name": "Glass Terminal 主题",
      "version": "1.0.1",
      "author": "codecloud-dev",
      "description": "液态玻璃风格的终端主题：半透明面板、毛玻璃背景、跟随系统的强调色。",
      "type": "theme",
      "minAppVersion": "0.6.0",
      "permissions": [],
      "price": 0.0,
      "purchased": false,
      "sizeBytes": 0,
      "tags": ["theme", "glass", "official"],
      "repository": "codecloud-dev/moxsh-plugins",
      "path": "plugins/glass-terminal-theme"
    }
  ]
}
